{
  "demo_id": "opa-rbac-parity",
  "title": "OPA / Rego Parity Demo",
  "subtitle": "Import-equivalent RBAC policy compiled into a deterministic pearl with parity and runtime artifacts.",
  "tagline": "Same shell, different domain: this pack is about policy parity and portability rather than evidence checklists.",
  "audience": [
    "platform engineers",
    "policy-engine owners",
    "OPA and Rego users"
  ],
  "theme": {
    "name": "OPA Parity",
    "accent": "#2257b8",
    "surface": "#eef2fb",
    "surface_alt": "#fbfcff",
    "text": "#16213a",
    "muted": "#5f6d8c"
  },
  "summary": {
    "problem": "Teams want to preserve existing policy behavior while gaining portable artifacts, small runtimes, and reproducible parity checks.",
    "why_logicpearl": "LogicPearl keeps the policy-core behavior deterministic, emits readable and executable artifacts, and validates parity against the original OPA behavior.",
    "scope": [
      "Compact RBAC policy",
      "Parity/import framing",
      "Readable pearl and executable IR",
      "Runtime and WASM outputs"
    ],
    "non_goals": [
      "Automatic discovery from traces",
      "General Rego transpilation coverage",
      "Full request-path latency equivalence",
      "Replacing observation/adaptation layers in this demo"
    ]
  },
  "stats": [
    {
      "label": "Parity",
      "value": "100.0%",
      "note": "Policy-core parity against OPA"
    },
    {
      "label": "Runtime",
      "value": "100.0%",
      "note": "Parity through pearl runtime artifacts"
    },
    {
      "label": "Rules",
      "value": "14",
      "note": "Compiled deterministic deny conditions"
    },
    {
      "label": "WASM",
      "value": "713B",
      "note": "OPA RBAC pearl runtime artifact"
    }
  ],
  "sources": [
    {
      "id": "rego_policy",
      "title": "RBAC Rego Policy",
      "kind": "policy source",
      "publisher": "Local benchmark policy",
      "url": "../../benchmarks/opa_rego/policy.rego",
      "note": "Source policy used for the parity/import benchmark.",
      "last_updated": null
    },
    {
      "id": "logicpearl_rule_pack",
      "title": "Equivalent LogicPearl Rule Pack",
      "kind": "artifact source",
      "publisher": "LogicPearl benchmark adapter",
      "url": "../../benchmarks/opa_rego/common.py",
      "note": "Equivalent hand-authored rule pack used for the current parity path.",
      "last_updated": null
    }
  ],
  "artifacts": [
    {
      "label": "Readable Pearl",
      "kind": "review artifact",
      "path": "../../benchmarks/opa_rego/output/pearl.json",
      "description": "Readable representation of the compiled rule pack."
    },
    {
      "label": "Executable Pearl IR",
      "kind": "runtime artifact",
      "path": "../../benchmarks/opa_rego/output/pearl.ir.json",
      "description": "Deterministic executable artifact for runtime and WASM generation."
    },
    {
      "label": "Parity Audit",
      "kind": "benchmark output",
      "path": "../../benchmarks/opa_rego/output/pearl_audit.json",
      "description": "Parity and latency summary for the OPA benchmark."
    },
    {
      "label": "WASM Pearl",
      "kind": "compiled binary",
      "path": "../../benchmarks/opa_rego/output/opa_rbac_pearl.wasm",
      "description": "Compiled WASM artifact for the parity demo."
    }
  ],
  "cases": [
    {
      "case_id": "policy_summary",
      "title": "Policy Summary",
      "result": "Parity maintained",
      "summary": "The benchmark preserves OPA policy-core behavior while producing portable pearl artifacts.",
      "bitmask": null,
      "failed_requirements": [
        "not applicable"
      ],
      "requirements": [
        {
          "requirement_id": "parity_accuracy",
          "label": "Parity accuracy against OPA",
          "satisfied": true,
          "source_excerpt": "Current benchmark output reports 100.0% parity accuracy.",
          "source_id": "rego_policy",
          "cluster_id": "benchmark",
          "matched_events": [
            "1000 requests"
          ]
        },
        {
          "requirement_id": "runtime_accuracy",
          "label": "Runtime parity through pearl artifacts",
          "satisfied": true,
          "source_excerpt": "Current benchmark output reports 100.0% runtime accuracy.",
          "source_id": "logicpearl_rule_pack",
          "cluster_id": "runtime",
          "matched_events": [
            "pearl-runtime",
            "WASM"
          ]
        }
      ]
    },
    {
      "case_id": "artifact_portability",
      "title": "Artifact Portability",
      "result": "Portable runtime achieved",
      "summary": "The same benchmark emits readable artifacts, executable IR, Rust source, and a small WASM artifact.",
      "bitmask": null,
      "failed_requirements": [
        "none"
      ],
      "requirements": [
        {
          "requirement_id": "readable_artifact",
          "label": "Readable pearl emitted",
          "satisfied": true,
          "source_excerpt": "The benchmark writes pearl.json with rule summaries.",
          "source_id": "logicpearl_rule_pack",
          "cluster_id": "artifact",
          "matched_events": [
            "pearl.json"
          ]
        },
        {
          "requirement_id": "compiled_wasm",
          "label": "Compiled WASM emitted",
          "satisfied": true,
          "source_excerpt": "The benchmark writes a 713-byte WASM pearl artifact.",
          "source_id": "logicpearl_rule_pack",
          "cluster_id": "artifact",
          "matched_events": [
            "opa_rbac_pearl.wasm"
          ]
        }
      ]
    }
  ]
}
